{
  "map_id": "AIO-SEMANTIC-SEARCH-MAP-v1",
  "version": "1.1",
  "updated": "2026-09-27",
  "owner_entity_id": "AIO-001",
  "primary_public_brand": "AIO CODE",
  "purpose": "Map likely audience questions to canonical concepts, bounded answer definitions, and first-party evidence sources. This is a query/content map, not a claim about search demand or external model retrieval.",
  "status": "draft_for_review",
  "questions": [
    {
      "query_id": "SEM-Q-001",
      "question": "What is AIO CODE?",
      "intent": "system_definition",
      "canonical_concept": "digital_entity_operating_system",
      "answer_first_definition": "AIO CODE is a Digital Entity Operating System connecting identity, evidence, provenance, content and observation; the research methodology is a component.",
      "evidence_refs": [
        "AIO-CODE-SYSTEM-SPEC-v2.md"
      ],
      "evidence_scope": "first_party_definition_or_method_record",
      "independent_validation": false,
      "linked_entities": [
        "AIO-001"
      ],
      "status": "draft"
    },
    {
      "query_id": "SEM-Q-002",
      "question": "What problem does AIO CODE address?",
      "intent": "entity_provenance",
      "canonical_concept": "entity_provenance",
      "answer_first_definition": "It organizes identity, claims, relationships and evidence so representations can be examined consistently across public information systems.",
      "evidence_refs": [
        "AIO-CODE-SYSTEM-SPEC-v2.md"
      ],
      "evidence_scope": "first_party_definition_or_method_record",
      "independent_validation": false,
      "linked_entities": [
        "AIO-001"
      ],
      "status": "draft"
    },
    {
      "query_id": "SEM-Q-003",
      "question": "How does an AI system identify a person or brand?",
      "intent": "entity_resolution",
      "canonical_concept": "entity_resolution",
      "answer_first_definition": "Resolution is a distinct stage from retrieval, representation, citation and recommendation; AIO CODE observes outputs under recorded conditions.",
      "evidence_refs": [
        "OBSERVATORY-PROTOCOL-v1.md"
      ],
      "evidence_scope": "first_party_definition_or_method_record",
      "independent_validation": false,
      "linked_entities": [
        "AIO-001"
      ],
      "status": "draft"
    },
    {
      "query_id": "SEM-Q-004",
      "question": "How can an artist build a coherent digital identity?",
      "intent": "artist_identity",
      "canonical_concept": "artist_identity",
      "answer_first_definition": "Define canonical identity, document supported claims, connect official sources and maintain consistent representations; outcomes are not guaranteed.",
      "evidence_refs": [
        "AIO-METHODOLOGY-SPEC-v1.md"
      ],
      "evidence_scope": "first_party_definition_or_method_record",
      "independent_validation": false,
      "linked_entities": [
        "AIO-001"
      ],
      "status": "draft"
    },
    {
      "query_id": "SEM-Q-005",
      "question": "How can creators improve discoverability in AI answers?",
      "intent": "creator_discoverability",
      "canonical_concept": "creator_discoverability",
      "answer_first_definition": "AIO CODE structures and documents public entity information, then observes retrieval and representation; it does not promise inclusion in answers.",
      "evidence_refs": [
        "AIO-METHODOLOGY-SPEC-v1.md"
      ],
      "evidence_scope": "first_party_definition_or_method_record",
      "independent_validation": false,
      "linked_entities": [
        "AIO-001"
      ],
      "status": "draft"
    },
    {
      "query_id": "SEM-Q-006",
      "question": "What is entity disambiguation?",
      "intent": "disambiguation",
      "canonical_concept": "disambiguation",
      "answer_first_definition": "Distinguishing one entity from other entities with similar names using documented attributes, relationships and sources.",
      "evidence_refs": [
        "RECOGNITION-RUBRIC-v1.md"
      ],
      "evidence_scope": "first_party_definition_or_method_record",
      "independent_validation": false,
      "linked_entities": [
        "AIO-001"
      ],
      "status": "draft"
    },
    {
      "query_id": "SEM-Q-007",
      "question": "How do you measure whether an AI recognizes an entity?",
      "intent": "recognition_measurement",
      "canonical_concept": "recognition_measurement",
      "answer_first_definition": "Use fixed prompts, fresh contexts, full response capture and separate categorical evaluation dimensions.",
      "evidence_refs": [
        "OBSERVATORY-PROTOCOL-v1.md"
      ],
      "evidence_scope": "first_party_definition_or_method_record",
      "independent_validation": false,
      "linked_entities": [
        "AIO-001"
      ],
      "status": "draft"
    },
    {
      "query_id": "SEM-Q-008",
      "question": "What is the difference between indexing and retrieval?",
      "intent": "indexing_retrieval",
      "canonical_concept": "indexing_retrieval",
      "answer_first_definition": "Indexing concerns inclusion in a searchable system; retrieval concerns whether relevant material is returned for a query. They are separate stages.",
      "evidence_refs": [
        "AIO-METHODOLOGY-SPEC-v1.md"
      ],
      "evidence_scope": "first_party_definition_or_method_record",
      "independent_validation": false,
      "linked_entities": [
        "AIO-001"
      ],
      "status": "draft"
    },
    {
      "query_id": "SEM-Q-009",
      "question": "What is the difference between retrieval and entity resolution?",
      "intent": "retrieval_resolution",
      "canonical_concept": "retrieval_resolution",
      "answer_first_definition": "Retrieval returns candidate sources; entity resolution determines which entity those sources describe.",
      "evidence_refs": [
        "RECOGNITION-RUBRIC-v1.md"
      ],
      "evidence_scope": "first_party_definition_or_method_record",
      "independent_validation": false,
      "linked_entities": [
        "AIO-001"
      ],
      "status": "draft"
    },
    {
      "query_id": "SEM-Q-010",
      "question": "What is citation drift in AI answers?",
      "intent": "citation_validity",
      "canonical_concept": "citation_validity",
      "answer_first_definition": "A citation can change, be stale, or fail to support the associated claim; capture and check each source per observation.",
      "evidence_refs": [
        "OBSERVATORY-PROTOCOL-v1.md"
      ],
      "evidence_scope": "first_party_definition_or_method_record",
      "independent_validation": false,
      "linked_entities": [
        "AIO-001"
      ],
      "status": "draft"
    },
    {
      "query_id": "SEM-Q-011",
      "question": "How can I check if AI answers cite reliable sources about my brand?",
      "intent": "citation_audit",
      "canonical_concept": "citation_audit",
      "answer_first_definition": "Record visible citations and assess whether each supports the specific claim and refers to the correct entity.",
      "evidence_refs": [
        "RECOGNITION-RUBRIC-v1.md"
      ],
      "evidence_scope": "first_party_definition_or_method_record",
      "independent_validation": false,
      "linked_entities": [
        "AIO-001"
      ],
      "status": "draft"
    },
    {
      "query_id": "SEM-Q-012",
      "question": "How do I create a knowledge graph for an artist?",
      "intent": "entity_graph",
      "canonical_concept": "entity_graph",
      "answer_first_definition": "Represent people, projects, content and sources as distinct nodes connected by explicit, sourced relationships.",
      "evidence_refs": [
        "entity-graph.json"
      ],
      "evidence_scope": "first_party_definition_or_method_record",
      "independent_validation": false,
      "linked_entities": [
        "AIO-001"
      ],
      "status": "draft"
    },
    {
      "query_id": "SEM-Q-013",
      "question": "How should an artist connect social profiles to one canonical identity?",
      "intent": "platform_mapping",
      "canonical_concept": "platform_mapping",
      "answer_first_definition": "Maintain an entity-specific platform registry with official status and verification dates; do not infer unverified profiles.",
      "evidence_refs": [
        "social-entity-map.json"
      ],
      "evidence_scope": "first_party_definition_or_method_record",
      "independent_validation": false,
      "linked_entities": [
        "AIO-001"
      ],
      "status": "draft"
    },
    {
      "query_id": "SEM-Q-014",
      "question": "What is a canonical entity passport?",
      "intent": "entity_passport",
      "canonical_concept": "entity_passport",
      "answer_first_definition": "A structured identity record that states the canonical name, entity type, attributes, boundaries and sourced relationships.",
      "evidence_refs": [
        "ENTITY-MASTER-RECORD.md"
      ],
      "evidence_scope": "first_party_definition_or_method_record",
      "independent_validation": false,
      "linked_entities": [
        "AIO-001"
      ],
      "status": "draft"
    },
    {
      "query_id": "SEM-Q-015",
      "question": "How can a creator document who made an AI-assisted work?",
      "intent": "content_provenance",
      "canonical_concept": "content_provenance",
      "answer_first_definition": "Record the master asset, human contribution, AI assistance, edits, versions, publication and evidence without treating provenance as automatic legal proof.",
      "evidence_refs": [
        "PROVENANCE-ARCHITECTURE.md"
      ],
      "evidence_scope": "first_party_definition_or_method_record",
      "independent_validation": false,
      "linked_entities": [
        "AIO-001"
      ],
      "status": "draft"
    },
    {
      "query_id": "SEM-Q-016",
      "question": "How do I protect rights for AI-assisted music and video?",
      "intent": "rights_management",
      "canonical_concept": "rights_management",